{
  "user": {
    "id": "user_role_request",
    "email": "doctor@example.com",
    "verifiedEmail": true,
    "role": "patient",
    "requestedRole": "doctor",
    "roleRequestStatus": "pending",
    "roleRequestedAt": "2026-07-30T10:00:00.000Z",
    "accountStatus": "active",
    "organizationId": "workspace_alpha",
    "name": "Bác sĩ An",
    "phone": "0912345678",
    "license": "CCHN-2026-001",
    "hospital": "Phòng khám An Khang",
    "department": "Tim mạch",
    "registrationReason": "Theo dõi bệnh nhân từ xa",
    "accountType": "doctor",
    "workspaceType": "clinic"
  },
  "roleRequest": {
    "requestedRole": "doctor",
    "status": "pending",
    "requestedAt": "2026-07-30T10:00:00.000Z"
  },
  "operationId": "role_request_20260730_canonical",
  "replayed": false
}
